1C4RJFAG9HC909383,0,0 - VIN decoded clean. Check Digit (9th position) is correct,1C4RJFAG*HC,,JEEP,FCA US LLC,Grand Cherokee,2017,DETROIT,WK,Laredo,MULTIPURPOSE PASSENGER VEHICLE (MPV),UNITED STATES (USA),Jefferson North Assembly,MICHIGAN,Sport Utility Vehicle (SUV)/Multi-Purpose Vehicle (MPV),4,"Class 2E: 6,001 - 7,000 lb (2,722 - 3,175 kg)",Not Applicable,Not Applicable,Not Applicable,Not Applicable,Not Applicable,Not Applicable,Not Applicable,4WD/4-Wheel Drive/4x4,Hydraulic,6,3600.0,219.68547874103,3.6,Gasoline,V-Shaped,,,Manual,1st Row (Driver and Passenger),All Rows,Direct,114.80,,,,4,17,17,Left-Hand Drive (LHD),5,2,,2,,,,295,,FCA,,Standard,Standard,Standard,Standard,,Standard,Optional,Optional,Optional,Standard,,Optional,Optional,Optional,Standard,,Optional,Standard,,Standard,32695,,117,,,,Active Seat Belt,,,,,,,,,,,,,,,Optional,,,,,,,,,,,,,,,,
WAUB8GFF5G1039075,0,0 - VIN decoded clean. Check Digit (9th position) is correct,WAUB8GFF*G1,,AUDI,AUDI AG,A3,2016,GYOR,,"quattro Premium, quattro Komfort (Canada)",PASSENGER CAR,HUNGARY,,,Sedan/Saloon,4,"Class 1: 6,000 lb or less (2,722 kg or less)",Not Applicable,Not Applicable,Not Applicable,Not Applicable,Not Applicable,Not Applicable,Not Applicable,AWD/All-Wheel Drive,,4,2000,122.0474881894,2,Gasoline,,Fuel: Gas (50-St); Emissions Certification Test Group: GVGAV02.0APA; Federal/California Emission Standard: PZEV II / Bin 2,,,1st Row (Driver and Passenger),1st Row (Driver and Passenger),Indirect,,"Class 1: 6,000 lb or less (2,722 kg or less)",Not Applicable,Not Applicable,,,,,,,Automatic,,,,,220,,Audi,1st Row (Driver and Passenger),,,,,,,,,,,,,,,,,,,,,,,,,,1st Row (Driver and Passenger),Restraint System: Active - Dr/Pass; Airbag - Dr/Pass; Advanced Front Airbags,,,,,,,,,,,,,,,,,,,,,,,,,,,,,,,
WBA13BJ0XMCF66340,0,0 - VIN decoded clean. Check Digit (9th position) is correct,WBA13BJ0*MC,,BMW,BMW AG,530i,2021,DINGOLFING,5-Series,xDrive,PASSENGER CAR,GERMANY,,,Sedan/Saloon,4,"Class 1: 6,000 lb or less (2,722 kg or less)",Not Applicable,Not Applicable,Not Applicable,Not Applicable,Not Applicable,Not Applicable,Not Applicable,AWD/All-Wheel Drive,,4,1997.5831016,121.9,1.9975831016,Gasoline,,,,Manual,1st Row (Driver and Passenger),1st Row (Driver and Passenger),Direct,,"Class 1: 6,000 lb or less (2,722 kg or less)",Not Applicable,Not Applicable,4,,,,5,2,Automatic,2,,,,248,,,1st Row (Driver and Passenger),Standard,Standard,Standard,Standard,,Standard,Optional,,Standard,Standard,,Standard,Standard,Standard,Standard,,Standard,Standard,LED,Standard,,,,8,,1st and 2nd Rows,Seat Belt: All Positions; Front/Rear: Pretensioner / Head Inflatable Restraint: Rear Outboard Driver-side & Rear Outboard Passenger-side,,,,,,Standard,"HD Radio, Bluetooth, Satellite Radio, Auxiliary Audio Input, MP3 Player",Yes,,,Standard,,,,Optional,,,,,,,,,,,,,,,,
JNKBV61F68M276962,0,0 - VIN decoded clean. Check Digit (9th position) is correct,JNKBV61F*8M,,INFINITI,"NISSAN MOTOR COMPANY, LTD",G35,2008,TOCHIGI,,,PASSENGER CAR,JAPAN,Tochigi Plant,KAMINOKAWA,Sedan/Saloon,4,"Class 1: 6,000 lb or less (2,722 kg or less)",Not Applicable,Not Applicable,Not Applicable,Not Applicable,Not Applicable,Not Applicable,Not Applicable,4WD/4-Wheel Drive/4x4,,,3500.0,213.58310433156,3.5,Gasoline,,,,Manual,1st Row (Driver and Passenger),1st Row (Driver and Passenger),Direct,,"Class 1: 6,000 lb or less (2,722 kg or less)",Not Applicable,Not Applicable,,,,,,,,,,,,,,,,,,,,,,,,,,,,,,,,,,,,,,,,,1st Row (Driver and Passenger),,,,,,,,,,,,,,,,,,,,,,,,,,,,,,,,
3C4NJDCB3KT627482,0,0 - VIN decoded clean. Check Digit (9th position) is correct,3C4NJDCB*KT,,JEEP,CHRYSLER DE MEXICO TOLUCA,Compass,2019,TOLUCA,,Limited,MULTIPURPOSE PASSENGER VEHICLE (MPV),MEXICO,Toluca Assembly,MEXICO,Sport Utility Vehicle (SUV)/Multi-Purpose Vehicle (MPV),4,"Class 1C: 4,001 - 5,000 lb (1,814 - 2,268 kg)",Not Applicable,Not Applicable,Not Applicable,Not Applicable,Not Applicable,Not Applicable,Not Applicable,4WD/4-Wheel Drive/4x4,Hydraulic,4,2400.0,146.45698582735,2.4,Gasoline,In-Line,,,Manual,1st Row (Driver and Passenger),All Rows,Direct,103.80,"Class 1C: 4,001 - 5,000 lb (1,814 - 2,268 kg)",,,4,18,18,Left-Hand Drive (LHD),5,2,,2,,,,180,,FCA,,Standard,Standard,Standard,Standard,,Standard,Optional,Optional,Optional,Standard,,Optional,Optional,Optional,Standard,,,Standard,,Standard,28940.00,,,,,,Active Belts,,,,,,,,,,,Optional,,,,,,,,,,,,,,,,,,,,
3FA6P0H94ER250329,0,0 - VIN decoded clean. Check Digit (9th position) is correct,3FA6P0H9*ER,,FORD,"FORD MOTOR COMPANY, MEXICO",Fusion,2014,HERMOSILLO,,SE,PASSENGER CAR,MEXICO,Hermosillo,,Sedan/Saloon,4,"Class 1: 6,000 lb or less (2,722 kg or less)",Not Applicable,Not Applicable,Not Applicable,Not Applicable,Not Applicable,Not Applicable,Not Applicable,FWD/Front-Wheel Drive,,4,2000.0,122.04748818946,2.0,Gasoline,In-Line,Premium Fuel,,Manual,1st Row (Driver and Passenger),1st and 2nd Rows,Direct,,"Class 1: 6,000 lb or less (2,722 kg or less)",Not Applicable,Not Applicable,,,,,,,,,,,,240,,Ford,1st Row (Driver and Passenger),,,,,,,,,,,,,,,,,,,,,,Stoichiometric Gasoline Direct Injection (SGDI),,,,,,,,,,,,,,,,,,,,,,,,,,,,,,,,,,,,
1B4GP44R3VB470395,0,0 - VIN decoded clean. Check Digit (9th position) is correct,1B4GP44R*VB,,DODGE,FCA US LLC,Caravan/Grand Caravan,1997,FENTON,,"SE, Sport",MULTIPURPOSE PASSENGER VEHICLE (MPV),UNITED STATES (USA),St Louis Assembly South,MISSOURI,Minivan,,"Class 1D: 5,001 - 6,000 lb (2,268 - 2,722 kg)",Not Applicable,Not Applicable,Not Applicable,Not Applicable,Not Applicable,Not Applicable,Not Applicable,FWD/Front-Wheel Drive,Hydraulic,6,3300.0,201.37835551261,3.3,Gasoline,V-Shaped,,,,,,,,,,,,,,,,,,,,,,,,,,,,,,,,,,,,,,,,,,,,,,,Multipoint Fuel Injection (MPFI),,,,,,,H Series,,,,,,,,,,,,,,,,,,,,,,,,,,,,,
5UXKR0C57G0P28137,0,0 - VIN decoded clean. Check Digit (9th position) is correct,5UXKR0C5*G0,,BMW,BMW MANUFACTURER CORPORATION / BMW NORTH AMERICA,X5,2016,GREER,,xDrive35i,MULTIPURPOSE PASSENGER VEHICLE (MPV),UNITED STATES (USA),,SOUTH CAROLINA,Sport Utility Vehicle (SUV)/Multi-Purpose Vehicle (MPV),4,"Class 2E: 6,001 - 7,000 lb (2,722 - 3,175 kg)",Not Applicable,Not Applicable,Not Applicable,Not Applicable,Not Applicable,Not Applicable,Not Applicable,AWD/All-Wheel Drive,,6,2979.1682352,181.8,3,Gasoline,,,,Manual,1st Row (Driver and Passenger),1st Row (Driver and Passenger),Direct,,,,,,,,,,,,,,,,300,,,1st Row (Driver and Passenger),,,,,,,,,,,,,,,,,,,,,,,,,,1st and 2nd Rows,Pretensioners for Driver and Front Passenger.,,,,,,,,Yes,,,,,,,,,,,,,,,,,,,,,,,
3C6JR6DT4HG728372,0,0 - VIN decoded clean. Check Digit (9th position) is correct,3C6JR6DT*HG,,RAM,CHRYSLER DE MEXICO TOLUCA,1500,2017,SALTILLO,DS,ST,TRUCK,MEXICO,Saltillo Truck Assembly,COAHUILA,Pickup,,"Class 2E: 6,001 - 7,000 lb (2,722 - 3,175 kg)",Not Applicable,Not Applicable,Not Applicable,Not Applicable,Not Applicable,Not Applicable,Not Applicable,4x2,Hydraulic,8,5700.0,347.83534133997,5.7,Gasoline,V-Shaped,,,Manual,1st Row (Driver and Passenger),1st Row (Driver and Passenger),,,,Long,Regular,4,17,17,Left-Hand Drive (LHD),3,1,,2,,,,395,,FCA,,Standard,Standard,Standard,Standard,,,,,,Standard,,,,,Optional,,,,,Standard,26495.00,,,,,,Active Seat Belt,,,,,,,Single Rear Wheels,,,,,,,,,,"The Model Year decoded for this VIN may be incorrect. If you know the Model year, please enter it and decode again to get more accurate information.",,,,,,,,,,,,,,
1D4RE4GG6BC734147,0,0 - VIN decoded clean. Check Digit (9th position) is correct,1D4RE4GG*BC,,DODGE,FCA US LLC,Durango,2011,DETROIT,,Crew,MULTIPURPOSE PASSENGER VEHICLE (MPV),UNITED STATES (USA),Jefferson North Assembly,MICHIGAN,Sport Utility Vehicle (SUV)/Multi-Purpose Vehicle (MPV),4,"Class 2E: 6,001 - 7,000 lb (2,722 - 3,175 kg)",Not Applicable,Not Applicable,Not Applicable,Not Applicable,Not Applicable,Not Applicable,Not Applicable,4WD/4-Wheel Drive/4x4,Hydraulic,6,3600.0,219.68547874103,3.6,Gasoline,V-Shaped,,No,Manual,1st Row (Driver and Passenger),All Rows,Direct,,"Class 2E: 6,001 - 7,000 lb (2,722 - 3,175 kg)",,,,,,Left-Hand Drive (LHD),,,,,,ERB,,295,,FCA,,,,,,,,,,,,,,,,,,,,,,,,,,,,Active Belts,,,,,,,,Yes,H (High Line),,,,,,,,,,,,,,,,,,,,,,
5TDJZRFH5JS845551,0,0 - VIN decoded clean. Check Digit (9th position) is correct,5TDJZRFH*JS,,TOYOTA,"TOYOTA MOTOR MANUFACTURING, INDIANA, INC.",Highlander,2018,PRINCETON,ASU50L/GSU50L/GSU55L/GVU58L,SE/XLE,MULTIPURPOSE PASSENGER VEHICLE (MPV),UNITED STATES (USA),"Toyota Motor Manufacturing, Indiana, Inc.",INDIANA,Sport Utility Vehicle (SUV)/Multi-Purpose Vehicle (MPV),5,"Class 1D: 5,001 - 6,000 lb (2,268 - 2,722 kg)",Not Applicable,Not Applicable,Not Applicable,Not Applicable,Not Applicable,Not Applicable,Not Applicable,4WD/4-Wheel Drive/4x4,,6,3500.0,213.58310433156,3.5,Gasoline,V-Shaped,VVT-i Engine; Port/Direct Fuel Injection  ,,Manual,1st Row (Driver and Passenger),1st Row (Driver and Passenger),Direct,109.8,,,,4,,,Left-Hand Drive (LHD),7,3,Automatic,2,,2GR-FKS,,295,,Toyota,Driver Seat Only,Standard,Standard,Standard,Standard,,Standard,Standard,Standard,Standard,Standard,Standard,Standard,Standard,Standard,Standard,,,Standard,,Standard,39120.00,,115,8,Dual Overhead Cam (DOHC),All Rows,,,Wagon body style,,Calipers / Front Vented Discs,,,,Yes,M Grade,Passenger Seat Only,Standard,,,,,,,,Standard,,,,,,1,,64.4,4310,,,
1N4AL3AP0HC193162,0,0 - VIN decoded clean. Check Digit (9th position) is correct,1N4AL3AP*HC,,NISSAN,"NISSAN NORTH AMERICA, INC.",Altima,2017,SMYRNA,,,PASSENGER CAR,UNITED STATES (USA),Nissan North America Inc.,TENNESSEE,Sedan/Saloon,4,"Class 1: 6,000 lb or less (2,722 kg or less)",Not Applicable,Not Applicable,Not Applicable,Not Applicable,Not Applicable,Not Applicable,Not Applicable,4x2,,4,2500.0,152.55936023683,2.5,Gasoline,In-Line,,,Manual,1st Row (Driver and Passenger),1st Row (Driver and Passenger),Direct,109.3,"Class 1: 6,000 lb or less (2,722 kg or less)",Not Applicable,Not Applicable,4,,,Left-Hand Drive (LHD),5,2,Continuously Variable Transmission (CVT),2,,,,,,,,Standard,Standard,Standard,Standard,,Standard,,,,Standard,,,,,Standard,,,,,,,,,,,1st and 2nd Rows,2nd row outboard and center 3-point manual belts,,,,,,,,,,,,,,,,,,,,,,,,,,,,,,,
5N3AA08C27N806146,0,0 - VIN decoded clean. Check Digit (9th position) is correct,5N3AA08C*7N,,INFINITI,"NISSAN NORTH AMERICA, INC.",QX56,2007,CANTON,,,MULTIPURPOSE PASSENGER VEHICLE (MPV),UNITED STATES (USA),Canton Plant,MISSISSIPPI,Sport Utility Vehicle (SUV)/Multi-Purpose Vehicle (MPV),4,"Class 2F: 7,001 - 8,000 lb (3,175 - 3,629 kg)",Not Applicable,Not Applicable,Not Applicable,Not Applicable,Not Applicable,Not Applicable,Not Applicable,4WD/4-Wheel Drive/4x4,,,5600.0,341.73296693050,5.6,Gasoline,,,,,,,Direct,,,,,4,,,,,,,,,,,,,,,Standard,,,,,,,,,,,,,,,,,,,,,,,,,,,,Wagon body,,,,,,,,,,,,,,,,,,,,,,,,,,,,,
1FM5K8F86HGC74412,0,0 - VIN decoded clean. Check Digit (9th position) is correct,1FM5K8F8*HG,,FORD,FORD MOTOR COMPANY,Explorer,2017,CHICAGO,,Limited,MULTIPURPOSE PASSENGER VEHICLE (MPV),UNITED STATES (USA),Chicago Assembly,ILLINOIS,Sport Utility Vehicle (SUV)/Multi-Purpose Vehicle (MPV),4,"Class 2E: 6,001 - 7,000 lb (2,722 - 3,175 kg)",Not Applicable,Not Applicable,Not Applicable,Not Applicable,Not Applicable,Not Applicable,Not Applicable,4WD/4-Wheel Drive/4x4,Hydraulic,6,3500.0,213.58310433156,3.5,Gasoline,V-Shaped,,,Manual,1st Row (Driver and Passenger),1st and 2nd and 3rd Rows,Direct,112.80,,,,4,20,20,Left-Hand Drive (LHD),7,3,,2,,3.5L Ti-VCT,,290,,Ford,Passenger Seat Only,Standard,Standard,Standard,Standard,,Standard,Optional,,Optional,Standard,,Optional,Optional,Optional,Standard,,Standard,Standard,,Standard,41675.00,,,,,,,,,,,,,,,,,Optional,,,,Optional,,,,,,,,,,,,,,,,
4T4BE46K79R138023,0,0 - VIN decoded clean. Check Digit (9th position) is correct,4T4BE46K*9R,,TOYOTA,"TOYOTA MOTOR MANUFACTURING, NORTHERN KENTUCKY, INC.",Camry,2009,LAFAYETTE,ACV40L/GSV40L/AHV40L,,PASSENGER CAR,UNITED STATES (USA),"Subaru of Indiana Automobile, Inc.",INDIANA,Sedan/Saloon,4,"Class 1: 6,000 lb or less (2,722 kg or less)",Not Applicable,Not Applicable,Not Applicable,Not Applicable,Not Applicable,Not Applicable,Not Applicable,4x2,,4,2362,146.45698582735,2.4,Gasoline,In-Line,,,Manual,1st Row (Driver and Passenger),1st Row (Driver and Passenger),Direct,,"Class 1: 6,000 lb or less (2,722 kg or less)",Not Applicable,Not Applicable,,,,,,,,,,2AZ-FE,,158,,Toyota,Driver Seat Only,,,,,,,,,,,,,,,,,,,,,,,,,Dual Overhead Cam (DOHC),1st Row (Driver and Passenger),,,,,,,,,,,,,,,Water,,,,170,,,,,,,,,,,,,
2C3KA53G26H407631,0,0 - VIN decoded clean. Check Digit (9th position) is correct,2C3KA53G*6H,"U.S., Canada, Mexico, Other Export Market (BUX)",CHRYSLER,FCA CANADA INC.,300,2006,BRAMPTON,LX,Touring,PASSENGER CAR,CANADA,Brampton Assembly,ONTARIO,Sedan/Saloon,4,"Class 1: 6,000 lb or less (2,722 kg or less)",Not Applicable,Not Applicable,Not Applicable,Not Applicable,Not Applicable,Not Applicable,Not Applicable,RWD/Rear-Wheel Drive,,6,3500.0,213.58310433156,3.5,Gasoline,V-Shaped,"Engine Info: 24V High Output, Sales Code : EGG",,Manual,1st Row (Driver and Passenger),,Direct,,"Class 1: 6,000 lb or less (2,722 kg or less)",Not Applicable,Not Applicable,,,,Left-Hand Drive (LHD),,,,,,,,,,,,,,,,,,,,,,,,,,,,,,,,,Multipoint Fuel Injection (MPFI),,,,,Restraint System Advanced Multistage Front Air Bags Sales Code (CG3) without side air bags sales code (CGS),,,,,,,Body Style is Sedan Tall,,P (Premium),,,,,,,,,,,,,,,,,,,,,,
1J4BA3H1XAL169313,0,0 - VIN decoded clean. Check Digit (9th position) is correct,1J4BA3H1*AL,"U.S., Canada, Mexico, Other Export Market (BUX)",JEEP,FCA US LLC,Wrangler,2010,TOLEDO,JK,Unlimited X,MULTIPURPOSE PASSENGER VEHICLE (MPV),UNITED STATES (USA),Toledo South Assembly,OHIO,Sport Utility Vehicle (SUV)/Multi-Purpose Vehicle (MPV),4,"Class 1D: 5,001 - 6,000 lb (2,268 - 2,722 kg)",Not Applicable,Not Applicable,Not Applicable,Not Applicable,Not Applicable,Not Applicable,Not Applicable,4WD/4-Wheel Drive/4x4,Hydraulic,6,3800.0,231.89022755998,3.8,Gasoline,,"Sales Code for Engine - EGL,EGT",No,Manual,1st Row (Driver and Passenger),,Direct,,,,,,,,Left-Hand Drive (LHD),,,,,,,,,,,,,,,,,,,,,,,,,,,,,,,,,,,,,,,,,,,,,Extended Open Body,Yes,M (Medium),,,,,,,,,,,,,,,,,,,,,,
1GCFG15X951228064,0,0 - VIN decoded clean. Check Digit (9th position) is correct,1GCFG15X*51,,CHEVROLET,GENERAL MOTORS LLC,Express,2005,WENTZVILLE,1500 (1/2 ton),,TRUCK,UNITED STATES (USA),GM Truck Corp,MISSOURI,Cargo Van,,"Class 2F: 7,001 - 8,000 lb (3,175 - 3,629 kg)",Not Applicable,Not Applicable,Not Applicable,Not Applicable,Not Applicable,Not Applicable,Not Applicable,4x2,Hydraulic,6,4300.0,262.40209960734,4.3,Gasoline,V-Shaped,90 Degrees,,,,,,,,,,,,,,,,,,,LU3,,,,WRN,,,,,,,,,,,,,,,,,,,,,,,Multipoint Fuel Injection (MPFI),,,Overhead Valve (OHV),,,,,,,,,,,,,,,,Water,,,,,,,,,,,,,,,,,
1C4NJDEB4FD217217,0,0 - VIN decoded clean. Check Digit (9th position) is correct,1C4NJDEB*FD,,JEEP,FCA US LLC,Compass,2015,BELVIDERE,,Latitude,MULTIPURPOSE PASSENGER VEHICLE (MPV),UNITED STATES (USA),Belvidere Assembly,ILLINOIS,Sport Utility Vehicle (SUV)/Multi-Purpose Vehicle (MPV),4,"Class 1C: 4,001 - 5,000 lb (1,814 - 2,268 kg)",Not Applicable,Not Applicable,Not Applicable,Not Applicable,Not Applicable,Not Applicable,Not Applicable,4WD/4-Wheel Drive/4x4,Hydraulic,4,2400.0,146.45698582735,2.4,Gasoline,,"Sales Code: ED3,ED6,ED7,ED8,EDD,EDE",No,Manual,1st Row (Driver and Passenger),All Rows,Direct,,,,,,,,Left-Hand Drive (LHD),,,,,,,,,,,,,,,,,,,,,,,,,,,,,,,,,,,,,,Active Seat Belt,,Body Style: Hatchback Tall,,,,,,,,,,,,,,,,,,,,,,,,,,,,,
WBAXG5C51DD230673,0,0 - VIN decoded clean. Check Digit (9th position) is correct,WBAXG5C5*DD,,BMW,BMW AG,528i,2013,DINGOLFING,5-Series,,PASSENGER CAR,GERMANY,,,Sedan/Saloon,4,"Class 1: 6,000 lb or less (2,722 kg or less)",Not Applicable,Not Applicable,Not Applicable,Not Applicable,Not Applicable,Not Applicable,Not Applicable,,,4,1995.9443952,121.8,2.0,Gasoline,,,,Manual,1st Row (Driver and Passenger),1st Row (Driver and Passenger),Direct,,"Class 1: 6,000 lb or less (2,722 kg or less)",Not Applicable,Not Applicable,,,,,,,,,,,,241,,,1st Row (Driver and Passenger),,,,,,,,,,,,,,,,,,,,,,,,,,1st and 2nd Rows,,,,,,,,,Yes,,,,,,,,,,,,,,,,,,,,,,,
2HNYD28427H507461,0,0 - VIN decoded clean. Check Digit (9th position) is correct,2HNYD284*7H,,ACURA,"HONDA OF CANADA MFG., A DIVISION OF HONDA CANADA INC.",MDX,2007,ALLISTON,,Tech,MULTIPURPOSE PASSENGER VEHICLE (MPV),CANADA,,ONTARIO,Sport Utility Vehicle (SUV)/Multi-Purpose Vehicle (MPV),5,"Class 1D: 5,001 - 6,000 lb (2,268 - 2,722 kg)",Not Applicable,Not Applicable,Not Applicable,Not Applicable,Not Applicable,Not Applicable,Not Applicable,,Hydraulic,6,3670.702336,224,3.670702336,Gasoline,V-Shaped,,,,,,Direct,,,,,,,,,,,Automatic,,,J37A1,,300,,,,,,,,,,,,,,,,,,,,,,,,,,,5,Single Overhead Cam (SOHC),,,,,,,,,PowerTailGate + Rear Entertainment System,,,,,,,,,,,,,,,,,,,,,,,,
1C6RR7MT4GS159121,0,0 - VIN decoded clean. Check Digit (9th position) is correct,1C6RR7MT*GS,,RAM,FCA US LLC,1500,2016,WARREN,,Sport,TRUCK,UNITED STATES (USA),Warren Truck Assembly,MICHIGAN,Pickup,,"Class 2E: 6,001 - 7,000 lb (2,722 - 3,175 kg)",Not Applicable,Not Applicable,Not Applicable,Not Applicable,Not Applicable,Not Applicable,Not Applicable,4WD/4-Wheel Drive/4x4,Hydraulic,8,5700.0,347.83534133997,5.7,Gasoline,,"Sales Code : EZC,EZH",No,Manual,1st Row (Driver and Passenger),All Rows,Direct,,,Short,Crew/Super Crew/Crew Max,,,,Left-Hand Drive (LHD),,,,,,,,,,,,,,,,,,,,,,,,,,,,,,,,,,,,,,Active Seat Belt,,,,,,,Single Rear Wheels,,,,,,,,,,"The Model Year decoded for this VIN may be incorrect. If you know the Model year, please enter it and decode again to get more accurate information.",,,,,,,,,,,,,,
2HKRM4H39DH677784,0,0 - VIN decoded clean. Check Digit (9th position) is correct,2HKRM4H3*DH,,HONDA,"HONDA OF CANADA MFG., A DIVISION OF HONDA CANADA INC.",CR-V,2013,ALLISTON,,LX,MULTIPURPOSE PASSENGER VEHICLE (MPV),CANADA,,ONTARIO,Sport Utility Vehicle (SUV)/Multi-Purpose Vehicle (MPV),5,"Class 1C: 4,001 - 5,000 lb (1,814 - 2,268 kg)",Not Applicable,Not Applicable,Not Applicable,Not Applicable,Not Applicable,Not Applicable,Not Applicable,AWD/All-Wheel Drive,,4,2354,144,2.4,Gasoline,In-Line,,,Manual,1st Row (Driver and Passenger),1st Row (Driver and Passenger),Direct,,,,,,,,,,,Automatic,,,K24Z7,,185,,Honda,,,,,,,,,,,,,,,,,,,,,,,,,5,Dual Overhead Cam (DOHC),1st and 2nd Rows,"seat belts: front, rear, rear center",,,,,,,,,,,,,,Water,,,,205,,,,,103.1,,,,71.6,3305,,,
YV1672MC3DJ141029,0,0 - VIN decoded clean. Check Digit (9th position) is correct,YV1672MC*DJ,,VOLVO,VOLVO CAR CORPORATION,C70,2013,UDDEVALLA,,,PASSENGER CAR,SWEDEN,Volvo Cars,,Convertible/Cabriolet,2,"Class 1: 6,000 lb or less (2,722 kg or less)",Not Applicable,Not Applicable,Not Applicable,Not Applicable,Not Applicable,Not Applicable,Not Applicable,FWD/Front-Wheel Drive,,5,2521,152.55936023683,2.5,Gasoline,In-Line,RPM: 5000,,Manual,1st Row (Driver and Passenger),,Direct,,"Class 1: 6,000 lb or less (2,722 kg or less)",Not Applicable,Not Applicable,,,,,,,,,,B5254T7,,227,,Volvo,,,,,,,,,,,,,,,,,,,,,,,,,,Dual Overhead Cam (DOHC),1st Row (Driver and Passenger),3 point seatbelt on all designated seating positions,,,,,,,,,,1st Row (Driver and Passenger),,,,Water,,,,,,,,,,,,,,,,,
KM8J33A42JU656060,0,0 - VIN decoded clean. Check Digit (9th position) is correct,KM8J33A4*JU,,HYUNDAI,HYUNDAI MOTOR CO,Tucson,2018,ULSAN,,"SE Pop, SE Plus, Eco, Sport, Value, Ultimate Base/Ultimate",MULTIPURPOSE PASSENGER VEHICLE (MPV),SOUTH KOREA,,,Sport Utility Vehicle (SUV)/Multi-Purpose Vehicle (MPV),4,"Class 1C: 4,001 - 5,000 lb (1,814 - 2,268 kg)",Not Applicable,Not Applicable,Not Applicable,Not Applicable,Not Applicable,Not Applicable,Not Applicable,4x2,,4,2000,122.0474881894,2,Gasoline,,,,Manual,1st Row (Driver and Passenger),1st Row (Driver and Passenger),Direct,105.10,,,,4,,,Left-Hand Drive (LHD),5,,Automatic,2,,GDI Nu,,164,,HMC,,Standard,Standard,Standard,,,,,,,,,,,,Standard,,,Standard,,,23800.00,,,6,Dual Overhead Cam (DOHC),1st and 2nd Rows,,"Blind Spot Detection and Keyless Ignition: Standard for SEL Plus, Sport, Value, Limited trims; Lane Departure Warning, PAEB, Crash Imminent Braking, Adaptive Driving Beam, Semiautomatic Headlamp Beam Switching: Optional for Limited trim; Automatic Crash Notification: Standard for SEL Plus and Limited trims",Wagon Body type,,,,,,,,,,,,,,,,,,,,,,,,,,,,,
WA1AWBF18MD031794,0,0 - VIN decoded clean. Check Digit (9th position) is correct,WA1AWBF1*MD,,AUDI,AUDI AG,SQ8,2021,BRATISLAVA,,quattro Premium Plus,MULTIPURPOSE PASSENGER VEHICLE (MPV),SLOVAKIA,,,Sport Utility Vehicle (SUV)/Multi-Purpose Vehicle (MPV),4,"Class 2E: 6,001 - 7,000 lb (2,722 - 3,175 kg)",Not Applicable,Not Applicable,Not Applicable,Not Applicable,Not Applicable,Not Applicable,Not Applicable,AWD/All-Wheel Drive,,8,4000,244.0949763789,4,Gasoline,,Emission Certification Test Group: MVGAT04.0NAV  Federal/California Emission Standard: Tier 3 BIN 125 LEV3ULEV125,,,1st Row (Driver and Passenger),All Rows,Indirect,117.9,,,,4,21,21,Left-Hand Drive (LHD),5,2,Automatic,2,,,,500,,Audi,,Standard,Standard,Standard,Standard,,Standard,Optional,Standard,Standard,,,Standard,Standard,Optional,Standard,Standard,Standard,Standard,LED,Standard,89100,,,8,,All Rows,,,,,,,Optional,"HD Radio, Bluetooth, Satellite Radio, Auxiliary Audio Input, MP3 Player  ",,,,,,,,,,,,,,,,,,,,,,,,
5UXKR0C57H0V66687,0,0 - VIN decoded clean. Check Digit (9th position) is correct,5UXKR0C5*H0,,BMW,BMW MANUFACTURER CORPORATION / BMW NORTH AMERICA,X5,2017,GREER,,xDrive35i,MULTIPURPOSE PASSENGER VEHICLE (MPV),UNITED STATES (USA),,SOUTH CAROLINA,Sport Utility Vehicle (SUV)/Multi-Purpose Vehicle (MPV),4,"Class 2E: 6,001 - 7,000 lb (2,722 - 3,175 kg)",Not Applicable,Not Applicable,Not Applicable,Not Applicable,Not Applicable,Not Applicable,Not Applicable,AWD/All-Wheel Drive,,6,2979.1682352,181.8,3,Gasoline,,,,Manual,1st Row (Driver and Passenger),1st Row (Driver and Passenger),Direct,115.50,,,,4,19,19,Left-Hand Drive (LHD),5,2,Automatic,2,,,,300,,,1st Row (Driver and Passenger),Standard,Standard,Standard,Standard,,Standard,Optional,Optional,Optional,Standard,,Optional,Optional,Optional,Standard,,Optional,Standard,,Standard,58900.00,,130,8,,1st and 2nd Rows,Pretensioners for Driver and Front Passenger.,,,,,,,,Yes,,,Standard,,,,Optional,,,,,,,,,,,,,,,,
3C4NJDAB6KT703313,0,0 - VIN decoded clean. Check Digit (9th position) is correct,3C4NJDAB*KT,,JEEP,CHRYSLER DE MEXICO TOLUCA,Compass,2019,TOLUCA,,Sport,MULTIPURPOSE PASSENGER VEHICLE (MPV),MEXICO,Toluca Assembly,MEXICO,Sport Utility Vehicle (SUV)/Multi-Purpose Vehicle (MPV),4,"Class 1C: 4,001 - 5,000 lb (1,814 - 2,268 kg)",Not Applicable,Not Applicable,Not Applicable,Not Applicable,Not Applicable,Not Applicable,Not Applicable,4WD/4-Wheel Drive/4x4,Hydraulic,4,2400.0,146.45698582735,2.4,Gasoline,In-Line,,,Manual,1st Row (Driver and Passenger),All Rows,Direct,103.80,"Class 1C: 4,001 - 5,000 lb (1,814 - 2,268 kg)",,,4,16,16,Left-Hand Drive (LHD),5,2,,2,,,,180,,FCA,,Standard,Standard,Standard,Standard,,Standard,,,,Standard,,,,,Standard,,,Standard,,Standard,22095.00,,,,,,Active Belts,,,,,,,,,,,,,,,,,,,,,,,,,,,,,,,
3N1AB7AP8JY249093,0,0 - VIN decoded clean. Check Digit (9th position) is correct,3N1AB7AP*JY,,NISSAN,"NISSAN MEXICANA, S.A. DE C.V.",Sentra,2018,AGUASCALIENTES,,,PASSENGER CAR,MEXICO,"Nissan Mexicana, S.A. de C.V.",AGUASCALIENTES,Sedan/Saloon,4,"Class 1: 6,000 lb or less (2,722 kg or less)",Not Applicable,Not Applicable,Not Applicable,Not Applicable,Not Applicable,Not Applicable,Not Applicable,4x2,,4,1800.0,109.84273937051,1.8,Gasoline,In-Line,,,Manual,1st Row (Driver and Passenger),1st Row (Driver and Passenger),Direct,106.3,"Class 1: 6,000 lb or less (2,722 kg or less)",Not Applicable,Not Applicable,4,,,Left-Hand Drive (LHD),5,2,,2,,,,130,,,,Standard,Standard,,Standard,,Standard,,,,,,,,,Standard,,,,,,16685,,118,,,1st and 2nd Rows,2nd row outboard and center 3-point manual belts,"Rear Cross Traffic Alert: Optional for SR trim, Standard for SL trim; Traction Control: Standard for Dynamic Brake Support; Blind Sport Detection: Optional for SR trim, Standard for SL trim; Crash Imminent Braking: Optional for S trim, Standard for SV, SR and SL trims; Adaptive Cruise Control: Optional for SR and SL trims",,,,,,,,,,,,,,,,,,,,,,,,,,,,,,
5N1AZ2MG2HN127985,0,0 - VIN decoded clean. Check Digit (9th position) is correct,5N1AZ2MG*HN,,NISSAN,"NISSAN NORTH AMERICA, INC.",Murano,2017,CANTON,,,MULTIPURPOSE PASSENGER VEHICLE (MPV),UNITED STATES (USA),Nissan North America Inc.,MISSISSIPPI,Crossover Utility Vehicle (CUV),4,"Class 1D: 5,001 - 6,000 lb (2,268 - 2,722 kg)",Not Applicable,Not Applicable,Not Applicable,Not Applicable,Not Applicable,Not Applicable,Not Applicable,4x2,,,3500.0,213.58310433156,3.5,Gasoline,,,,Manual,1st Row (Driver and Passenger),1st Row (Driver and Passenger),Direct,111.20,,,,4,,,Left-Hand Drive (LHD),5,2,Continuously Variable Transmission (CVT),2,,,,,,,,Standard,Standard,Standard,Standard,,Standard,,,,Standard,,,,,Standard,,,Standard,,Standard,,,,,,1st and 2nd Rows,2nd row outboard and center 3-point manual belts,,Wagon body style,,,,,,,,,,,,,,,,,,,,,,,,,,,,,
JN1BV7AR7FM423808,0,0 - VIN decoded clean. Check Digit (9th position) is correct,JN1BV7AR*FM,,INFINITI,"NISSAN MOTOR COMPANY, LTD",Q50,2015,"TOCHIGI PLANT, KAWACHI-GUN",,,PASSENGER CAR,JAPAN,"Nissan Motor Company, Ltd.",TOCHIGI,Sedan/Saloon,4,"Class 1: 6,000 lb or less (2,722 kg or less)",Not Applicable,Not Applicable,Not Applicable,Not Applicable,Not Applicable,Not Applicable,Not Applicable,AWD/All-Wheel Drive,,,3700.0,225.78785315050,3.7,Gasoline,,,,Manual,1st Row (Driver and Passenger),1st and 2nd Rows,Direct,,"Class 1: 6,000 lb or less (2,722 kg or less)",Not Applicable,Not Applicable,,,,,,,,,,,,,,,,,,,,,,,,,,,,,,,,,,,,,,,,,1st and 2nd Rows,,,,,,,,,,,,,,,,,,,,,,,,,,,,,,,,
