5TDKZ3DC6LS067210,0,0 - VIN decoded clean. Check Digit (9th position) is correct,5TDKZ3DC*LS,,TOYOTA,"TOYOTA MOTOR MANUFACTURING, INDIANA, INC.",Sienna,2020,PRINCETON,GSL30L/GSL33L/GSL35L,E grade,MULTIPURPOSE PASSENGER VEHICLE (MPV),UNITED STATES (USA),"Toyota Motor Manufacturing, Indiana, Inc.",INDIANA,Minivan,5,"Class 1D: 5,001 - 6,000 lb (2,268 - 2,722 kg)",Not Applicable,Not Applicable,Not Applicable,Not Applicable,Not Applicable,Not Applicable,Not Applicable,4x2,,6,3500.0,213.58310433156,3.5,Gasoline,V-Shaped,PORT+DIRECT,,Manual,1st Row (Driver and Passenger),1st Row (Driver and Passenger),Direct,119.3,,,,4,,,Left-Hand Drive (LHD),7,2,Automatic,2,,2GR-FKS,,296,,,Driver Seat Only,Standard,Standard,Standard,Standard,,,Standard,Standard,Standard,Standard,Standard,,Standard,Standard,Standard,,Standard,Standard,,Standard,,,,8,Dual Overhead Cam (DOHC),All Rows,,Blind Spot Detection & Keyless Ignition: Optional for LE/SE / Standard for XLE/Limited,Wagon body style,,,,,,,,,Standard,,,,,,,,,,,,,,,,,,,,
1C4RJHET0N8510640,0,0 - VIN decoded clean. Check Digit (9th position) is correct,1C4RJHET*N8,,JEEP,FCA US LLC,Grand Cherokee,2022,DETROIT,,Summit,MULTIPURPOSE PASSENGER VEHICLE (MPV),UNITED STATES (USA),Mack Assembly,MICHIGAN,Sport Utility Vehicle (SUV)/Multi-Purpose Vehicle (MPV),4,"Class 2E: 6,001 - 7,000 lb (2,722 - 3,175 kg)",Not Applicable,Not Applicable,Not Applicable,Not Applicable,Not Applicable,Not Applicable,Not Applicable,4WD/4-Wheel Drive/4x4,Hydraulic,8,5700.0,347.83534133997,5.7,Gasoline,V-Shaped,,,Manual,1st Row (Driver and Passenger),All Rows,Direct,,"Class 2E: 6,001 - 7,000 lb (2,722 - 3,175 kg)",,,,,,Left-Hand Drive (LHD),,2,Automatic,,,,,357,,FCA,,Standard,Standard,Standard,Standard,,,,Standard,Standard,Standard,Standard,Standard,Standard,Standard,Standard,,,Standard,LED,Standard,,,,8,,,Active Belts,,,Standard,,,,,,,,Standard,,,,Standard,,,,,,,,,,,,,,,,
3MYDLBYV3JY324900,0,0 - VIN decoded clean. Check Digit (9th position) is correct,3MYDLBYV*JY,,TOYOTA,MAZDA MOTOR MANUFACTURING DE MEXICO S.A. DE C.V.,Yaris iA,2018,GUANAJUATO,,,PASSENGER CAR,MEXICO,MMMdM (Mazda Motor Manufacturing de Mexico),SALAMANCA,Sedan/Saloon,4,"Class 1: 6,000 lb or less (2,722 kg or less)",Not Applicable,Not Applicable,Not Applicable,Not Applicable,Not Applicable,Not Applicable,Not Applicable,,,4,1500.0,91.53561614209,1.5,Gasoline,In-Line,,,Manual,1st Row (Driver and Passenger),1st Row (Driver and Passenger),,,"Class 1: 6,000 lb or less (2,722 kg or less)",Not Applicable,Not Applicable,,,,,,,,,,P5V,,106,,Mazda,,,,,,,,,,,,,,,,,,,,,,,,,,,1st and 2nd Rows,,,,,,,,"Plant Company - MMMdM (Mazda Motor Manufacturing de Mexico, S.A., de C.V.)",,,,,,,,,,,,,,,,,,,,,,,,
19UUB2F54FA004776,0,0 - VIN decoded clean. Check Digit (9th position) is correct,19UUB2F5*FA,,ACURA,"AMERICAN HONDA MOTOR CO., INC.",TLX,2015,MARYVILLE,,TECH V6,PASSENGER CAR,UNITED STATES (USA),,OHIO,Sedan/Saloon,4,"Class 1C: 4,001 - 5,000 lb (1,814 - 2,268 kg)",Not Applicable,Not Applicable,Not Applicable,Not Applicable,Not Applicable,Not Applicable,Not Applicable,FWD/Front-Wheel Drive,,6,3474.057568,212,3.474057568,Gasoline,V-Shaped,,,Manual,1st Row (Driver and Passenger),1st Row (Driver and Passenger),Direct,,"Class 1: 6,000 lb or less (2,722 kg or less)",Not Applicable,Not Applicable,,,,,5,2,Automatic,,,J35Y6,,290,,,Driver Seat Only,Standard,Standard,Standard,Standard,,Standard,,,,Standard,,Standard,Standard,,Standard,,,Standard,,Standard,,,,9,Single Overhead Cam (SOHC),1st and 2nd Rows,,,,,,,,,,,,,,,,,,,,,,,,,,,,,,,,
5XYP64HC6MG102471,0,0 - VIN decoded clean. Check Digit (9th position) is correct,5XYP64HC*MG,,KIA,"KIA GEORGIA, INC",Telluride,2021,,,S,MULTIPURPOSE PASSENGER VEHICLE (MPV),UNITED STATES (USA),Kia Motors Manufacturing Georgia Inc. (KMMG),GEORGIA,Sport Utility Vehicle (SUV)/Multi-Purpose Vehicle (MPV),,"Class 1D: 5,001 - 6,000 lb (2,268 - 2,722 kg)",Not Applicable,Not Applicable,Not Applicable,Not Applicable,Not Applicable,Not Applicable,Not Applicable,4x2,,6,3800.0,231.89022755998,3.8,Gasoline,,,,Manual,1st Row (Driver and Passenger),1st Row (Driver and Passenger),Direct,114.2,,,,4,20,20,Left-Hand Drive (LHD),7,3,Automatic,2,,KMC GDI Lambda-II,,291,,,Driver Seat Only,Standard,Standard,Standard,Standard,,Standard,Standard,,Standard,Standard,Standard,Standard,Standard,Standard,Standard,,,Standard,LED,Standard,34390.00,,,8,Dual Overhead Cam (DOHC),1st and 2nd and 3rd Rows,,,Wagon body style,,,,,,,,,,,,,Standard,,,,,,,,,,,,,,,,
4T1C31AK2RU630484,0,0 - VIN decoded clean. Check Digit (9th position) is correct,4T1C31AK*RU,,TOYOTA,"TOYOTA MOTOR MANUFACTURING, KENTUCKY, INC.",Camry,2024,GEORGETOWN,70 Series,LE,PASSENGER CAR,UNITED STATES (USA),"Toyota Motor Manufacturing. Kentucky, Inc.",KENTUCKY,Sedan/Saloon,4,"Class 1: 6,000 lb or less (2,722 kg or less)",Not Applicable,Not Applicable,Not Applicable,Not Applicable,Not Applicable,Not Applicable,Not Applicable,4x2,,4,2500.0,152.55936023683,2.5,Gasoline,In-Line,"Port+Direct, L4 / Motor: 3NM",,Manual,1st Row (Driver and Passenger),1st and 2nd Rows,,,"Class 1: 6,000 lb or less (2,722 kg or less)",Not Applicable,Not Applicable,,,,,5,2,Automatic,,,A25A-FXS,Electric,176,HEV (Hybrid Electric Vehicle) - Level Unknown,,1st Row (Driver and Passenger),Standard,Standard,Standard,Standard,,,Standard,Standard,Standard,Standard,Standard,Optional,Standard,Standard,Standard,Optional,Standard,Standard,LED,Standard,,,,8,,1st and 2nd Rows,Seat Belt: All Seats,,,,,,,,,,,,,Standard,,,,,,,,,Lithium-Ion/Li-Ion,,,,,,,,,
2HGFC2F69MH540877,0,0 - VIN decoded clean. Check Digit (9th position) is correct,2HGFC2F6*MH,,HONDA,"HONDA OF CANADA MFG., A DIVISION OF HONDA CANADA INC.",Civic,2021,ALLISTON,,LX,PASSENGER CAR,CANADA,,ONTARIO,Sedan/Saloon,4,"Class 1B: 3,001 - 4,000 lb (1,360 - 1,814 kg)",Not Applicable,Not Applicable,Not Applicable,Not Applicable,Not Applicable,Not Applicable,Not Applicable,4x2,,4,1996,122.04748818946,2.0,Gasoline,In-Line,Sequential Multiport Fuel Injection,,Manual,1st Row (Driver and Passenger),1st Row (Driver and Passenger),Indirect,106.3,"Class 1: 6,000 lb or less (2,722 kg or less)",Not Applicable,Not Applicable,4,16,16,Left-Hand Drive (LHD),5,2,Continuously Variable Transmission (CVT),2,,K20C2,,158,,Honda,,Standard,Standard,Standard,Standard,,Standard,Standard,Standard,Standard,Standard,,,Standard,Standard,Standard,,,Standard,Halogen,Standard,21250,Sequential Fuel Injection (SFI),,,Dual Overhead Cam (DOHC),1st and 2nd Rows,Front: Seat Belt / Rear: Seat Belt and Side Curtain Air Bag (Outer positions) / Seat Belt (Center position),,,,,,,"Bluetooth, Auxiliary Audio Input, MP3 Player  ",,,,,4,,Water,,,,,,,,,,,,,,,,,
1FTBR1C84LKB61059,0,0 - VIN decoded clean. Check Digit (9th position) is correct,1FTBR1C8*LK,,FORD,FORD MOTOR COMPANY,Transit,2020,KANSAS CITY,250,Medium Roof,TRUCK,UNITED STATES (USA),,MISSOURI,Cargo Van,,"Class 2H: 9,001 - 10,000 lb (4,082 - 4,536 kg)",Not Applicable,Not Applicable,Not Applicable,Not Applicable,Not Applicable,Not Applicable,Not Applicable,RWD/Rear-Wheel Drive,Hydraulic,6,3500.0,213.58310433156,3.5,Gasoline,V-Shaped,,,Manual,1st Row (Driver and Passenger),1st Row (Driver and Passenger),,130,,,,,,,,,,,,,3.5L V6 Cyclone,,275,,Ford,,,,,,,,,,,,,,,,,,,,,,,,,,,,,,,,,,,GVWR: 9070 lbs,,,,,,,,,,"The Model Year decoded for this VIN may be incorrect. If you know the Model year, please enter it and decode again to get more accurate information.",,,,,,148,,,,,,,,
WDCTG4GB9JJ521618,0,0 - VIN decoded clean. Check Digit (9th position) is correct,WDCTG4GB*JJ,,MERCEDES-BENZ,MERCEDES-BENZ CARS,GLA-Class,2018,RASTATT,,GLA250-4M,MULTIPURPOSE PASSENGER VEHICLE (MPV),GERMANY,,,Sport Utility Vehicle (SUV)/Multi-Purpose Vehicle (MPV),4,"Class 1C: 4,001 - 5,000 lb (1,814 - 2,268 kg)",Not Applicable,Not Applicable,Not Applicable,Not Applicable,Not Applicable,Not Applicable,Not Applicable,,,4,2000.0,122.04748818946,2.0,Gasoline,In-Line,,Yes,Manual,1st Row (Driver and Passenger),1st and 2nd Rows,Direct,,,,,,,,,,,Automated Manual Transmission (AMT),,,270,,208,,Daimler,,,,,,,,,,,,,,,,,,,,,,,Stoichiometric Gasoline Direct Injection (SGDI),,7,Dual Overhead Cam (DOHC),,Type 2 seat belts for all occupants. Seat belts on all outboard designated seating positions are equipped with load limiters and pretensioners.,,,,,,,Some of the decoding information provided may vary for non-U.S. market vehicles.,Yes,,,,4,,Water,,,,,,,,,,,,,,,,,
54DC4W1D2LS209587,0,0 - VIN decoded clean. Check Digit (9th position) is correct,54DC4W1D*LS,,ISUZU,"THE SHYFT GROUP, INC.",NPR-HD,2020,CHARLOTTE,,,INCOMPLETE VEHICLE,UNITED STATES (USA),,MICHIGAN,Incomplete - Chassis Cab (Single Cab),,"Class 4: 14,001 - 16,000 lb (6,350 - 7,258 kg)",Not Applicable,Not Applicable,Not Applicable,Not Applicable,Not Applicable,,,4x2,Hydraulic,8,6600.0,402.75671102523,6.6,Gasoline,V-Shaped,,,,,,,,,,MDHD: Tilt,,,,,,,,2,,L8T,,357,,GM,,,,,,,,,,,,,,,,,,,,,,,,,,,,,,,,,,,"TILT Low Cab Forward / GVWR: 14,500 lbs",,,,,,,,,,"Incomplete Vehicle Warning - Please be advised that the vehicle may have been altered and may not be an accurate representation of the vehicle in its current condition. The Model Year decoded for this VIN may be incorrect. If you know the Model year, please enter it and decode again to get more accurate information.",,,,,,,,,,,,,,
4JGDA5HB1HA878877,0,0 - VIN decoded clean. Check Digit (9th position) is correct,4JGDA5HB*HA,,MERCEDES-BENZ,"MERCEDES-BENZ OF NORTH AMERICA, INC.",GLE-Class,2017,VANCE,,GLE350,MULTIPURPOSE PASSENGER VEHICLE (MPV),UNITED STATES (USA),,,Sport Utility Vehicle (SUV)/Multi-Purpose Vehicle (MPV),5,"Class 2E: 6,001 - 7,000 lb (2,722 - 3,175 kg)",Not Applicable,Not Applicable,Not Applicable,Not Applicable,Not Applicable,Not Applicable,Not Applicable,,,6,3500.00,213.583104331562,3.50,Gasoline,V-Shaped,"L-7, DFI",No,Manual,1st Row (Driver and Passenger),1st and 2nd Rows,Direct,114.80,,,,4,19,19,Left-Hand Drive (LHD),5,2,Automatic,2,,M276,,302,,Daimler,,Standard,Standard,Standard,Standard,,Standard,Optional,Optional,Optional,Standard,,Optional,Optional,Optional,Standard,,Standard,Standard,,Standard,,,,7,Dual Overhead Cam (DOHC),,Type 2 seat belts for all occupants. Seat belts on all outboard designated seating positions are equipped with load limiters and pretensioners.,,,,,,,Some of the decoding information provided may vary for non-U.S. market vehicles.,Yes,Base 4-M,,Optional,4,,Water,,,,,,,,,,,,,,,,,
5TDXBRCH0PS582400,0,0 - VIN decoded clean. Check Digit (9th position) is correct,5TDXBRCH*PS,,TOYOTA,"TOYOTA MOTOR MANUFACTURING, INDIANA, INC.",Highlander,2023,PRINCETON,78 Series,Limited,MULTIPURPOSE PASSENGER VEHICLE (MPV),UNITED STATES (USA),"Toyota Motor Manufacturing, Indiana, Inc.",INDIANA,Sport Utility Vehicle (SUV)/Multi-Purpose Vehicle (MPV),5,"Class 1D: 5,001 - 6,000 lb (2,268 - 2,722 kg)",Not Applicable,Not Applicable,Not Applicable,Not Applicable,Not Applicable,Not Applicable,Not Applicable,4WD/4-Wheel Drive/4x4,,4,2500.0,152.55936023683,2.5,Gasoline,In-Line,"PORT+DIRECT, L4",,Manual,1st Row (Driver and Passenger),1st Row (Driver and Passenger),Direct,,"Class 1D: 5,001 - 6,000 lb (2,268 - 2,722 kg)",,,,,,,7,3,Electronic Continuously Variable (e-CVT),,,"A25A-FXS, 5NM+4NM",Electric,186,HEV (Hybrid Electric Vehicle) - Level Unknown,,Driver Seat Only,Standard,Standard,Standard,Standard,,Standard,Standard,Standard,Standard,Standard,Standard,Standard,Standard,Standard,Standard,Standard,,Standard,LED,Standard,,,,,,1st and 2nd and 3rd Rows,SEAT BELT: All Seats,,Wagon Body Style,,,,,,,,Passenger Seat Only,,,Standard,,Standard,,,,,,,Nickel-Metal-Hydride/NiMH,,1.90,,,,,,,
1C4HJXFG9PW655438,0,0 - VIN decoded clean. Check Digit (9th position) is correct,1C4HJXFG*PW,,JEEP,FCA US LLC,Wrangler,2023,TOLEDO,,Rubicon,MULTIPURPOSE PASSENGER VEHICLE (MPV),UNITED STATES (USA),Toledo North Assembly,OHIO,Sport Utility Vehicle (SUV)/Multi-Purpose Vehicle (MPV),4,"Class 1D: 5,001 - 6,000 lb (2,268 - 2,722 kg)",Not Applicable,Not Applicable,Not Applicable,Not Applicable,Not Applicable,Not Applicable,Not Applicable,4WD/4-Wheel Drive/4x4,Hydraulic,6,3600.0,219.68547874103,3.6,Gasoline,V-Shaped,,,Manual,1st Row (Driver and Passenger),1st Row (Driver and Passenger),Direct,,"Class 1D: 5,001 - 6,000 lb (2,268 - 2,722 kg)",,,,,,Left-Hand Drive (LHD),,,,,,,,285,,FCA,,Standard,Standard,Standard,,,Standard,,Optional,Optional,Optional,,Optional,,,Standard,,,Standard,,Optional,,,,,,,Active Belts,,Open Body,,,,,,,,,,,Standard,,,,,,,,,,,,,,,,,,
5FNYG1H72RB043002,0,0 - VIN decoded clean. Check Digit (9th position) is correct,5FNYG1H7*RB,,HONDA,"AMERICAN HONDA MOTOR CO., INC.",Pilot,2024,LINCOLN,,TOURING,MULTIPURPOSE PASSENGER VEHICLE (MPV),UNITED STATES (USA),,ALABAMA,Sport Utility Vehicle (SUV)/Multi-Purpose Vehicle (MPV),5,"Class 2E: 6,001 - 7,000 lb (2,722 - 3,175 kg)",Not Applicable,Not Applicable,Not Applicable,Not Applicable,Not Applicable,Not Applicable,Not Applicable,4WD/4-Wheel Drive/4x4,,6,3500.0,213.58310433156,3.5,Gasoline,V-Shaped,Direct Fuel Injection,,Manual,1st Row (Driver and Passenger),1st Row (Driver and Passenger),Direct,,,,,,,,,,3,Automatic,,,J35Y8,,285,,Honda,1st Row (Driver and Passenger),Standard,Standard,Standard,Standard,,Standard,Standard,Standard,Standard,Standard,Standard,Optional,Standard,Standard,Standard,Standard,,Standard,LED,Standard,,,,10,Dual Overhead Cam (DOHC),1st and 2nd and 3rd Rows,Front Row: Seat Belt / Mid & Rear Rows: Seat Belt and Side Curtain Air Bag (Outer positions) / Seat Belt (Center position),,,Standard,,Standard,,,,,,,4,,Water,,,,,,,,,,,,,,,,,
3GNKBBRA9KS609911,0,0 - VIN decoded clean. Check Digit (9th position) is correct,3GNKBBRA*KS,,CHEVROLET,GENERAL MOTORS LLC,Blazer,2019,RAMOS ARIZPE,,1LT,MULTIPURPOSE PASSENGER VEHICLE (MPV),MEXICO,,,Sport Utility Vehicle (SUV)/Multi-Purpose Vehicle (MPV),4,"Class 2E: 6,001 - 7,000 lb (2,722 - 3,175 kg)",Not Applicable,Not Applicable,Not Applicable,Not Applicable,Not Applicable,Not Applicable,Not Applicable,FWD/Front-Wheel Drive,Hydraulic,4,2500.0,152.55936023683,2.5,Gasoline,In-Line,"SIDI, DCVCP, VVT, E85 MAX, E0-E100, ALUM",,Manual,1st Row (Driver and Passenger),1st Row (Driver and Passenger),,112.70,,,,4,18,18,Left-Hand Drive (LHD),5,2,,2,,LCV,,,,,1st Row (Driver and Passenger),Standard,Standard,Standard,Standard,,Standard,,,,Standard,,Optional,,,Standard,,Standard,Standard,,Standard,33495.00,,130,,Dual Overhead Cam (DOHC),All Rows,,,,,,,,,,,,,,,,,,,,,,,,,,,,,,,,
1FA6P8CF7L5159227,0,0 - VIN decoded clean. Check Digit (9th position) is correct,1FA6P8CF*L5,,FORD,FORD MOTOR COMPANY,Mustang,2020,FLATROCK,,GT Coupe,PASSENGER CAR,UNITED STATES (USA),FRAP,MICHIGAN,Coupe,2,"Class 1: 6,000 lb or less (2,722 kg or less)",Not Applicable,Not Applicable,Not Applicable,Not Applicable,Not Applicable,Not Applicable,Not Applicable,,,8,5000,305.1187204736,5,Gasoline,V-Shaped,,,Manual,1st Row (Driver and Passenger),1st and 2nd Rows,Direct,,"Class 1: 6,000 lb or less (2,722 kg or less)",Not Applicable,Not Applicable,,,,,,,,,,TiVCT,,435,,Ford,1st Row (Driver and Passenger),,,,,,,,,,,,,,,,,,,,,,,,,,,,,,,,,,,,,,,,,,,,,,,,,,,,,,,,,,
1GNSKCKC3HR143423,0,0 - VIN decoded clean. Check Digit (9th position) is correct,1GNSKCKC*HR,,CHEVROLET,GENERAL MOTORS LLC,Tahoe,2017,ARLINGTON,,Premier,MULTIPURPOSE PASSENGER VEHICLE (MPV),UNITED STATES (USA),GMNA,TEXAS,Sport Utility Vehicle (SUV)/Multi-Purpose Vehicle (MPV),4,"Class 2F: 7,001 - 8,000 lb (3,175 - 3,629 kg)",Not Applicable,Not Applicable,Not Applicable,Not Applicable,Not Applicable,Not Applicable,Not Applicable,4WD/4-Wheel Drive/4x4,,8,5300.0,323.42584370208,5.3,Gasoline,,,,Manual,1st Row (Driver and Passenger),1st Row (Driver and Passenger),Direct,116.00,,,,4,20,20,Left-Hand Drive (LHD),7,3,Automatic,2,,"L83 - SIDI: Spark Ignited Direct Injection, VVT: Variable Valve Timing, AFM, E85 MAX, ALUM",Ethanol (E85),,,GM,,Standard,Standard,Standard,Standard,,Standard,Optional,Standard,Standard,Standard,,Standard,Standard,Standard,Standard,,Standard,Standard,,Standard,62030.00,,136,6,,All Rows,Front Inboard Seat Side AIr bag in First Row,,,,,,,,,,,Standard,,,,,,,,,,,,,,,,,,,,
5NMZUDLB5JH097942,0,0 - VIN decoded clean. Check Digit (9th position) is correct,5NMZUDLB*JH,,HYUNDAI,HYUNDAI MOTOR MANUFACTURING ALABAMA LLC (HMMA),Santa Fe Sport,2018,,,"Sport Value Pkg ,Sport Premium pkg, Sport Tech pkg ,Sport 2.0T Base",MULTIPURPOSE PASSENGER VEHICLE (MPV),UNITED STATES (USA),,ALABAMA,Sport Utility Vehicle (SUV)/Multi-Purpose Vehicle (MPV),4,"Class 1D: 5,001 - 6,000 lb (2,268 - 2,722 kg)",Not Applicable,Not Applicable,Not Applicable,Not Applicable,Not Applicable,Not Applicable,Not Applicable,4WD/4-Wheel Drive/4x4,,4,2400.0,146.45698582735,2.4,Gasoline,,,,Manual,1st Row (Driver and Passenger),1st Row (Driver and Passenger),Direct,,,,,,,,,,,,,,GDI THETA II,,185,,HMC,Driver Seat Only,,,,,,,,,,,,,,,,,,,,,,,,,Dual Overhead Cam (DOHC),1st and 2nd Rows,,,Wagon body Type,,,,,,,,,,,,,,,,,,,,,,,,,,,,,
5YJ3E1EB1KF418117,0,0 - VIN decoded clean. Check Digit (9th position) is correct,5YJ3E1EB*KF,,TESLA,"TESLA, INC.",Model 3,2019,FREMONT,,,PASSENGER CAR,UNITED STATES (USA),,CALIFORNIA,Sedan/Saloon,4,"Class 1: 6,000 lb or less (2,722 kg or less)",Not Applicable,Not Applicable,Not Applicable,Not Applicable,Not Applicable,Not Applicable,Not Applicable,,,,,,,Electric,,Dual Motor - Standard,,Manual,1st Row (Driver and Passenger),1st Row (Driver and Passenger),Direct,113.20,"Class 1: 6,000 lb or less (2,722 kg or less)",Not Applicable,Not Applicable,4,,,Left-Hand Drive (LHD),5,2,Automatic,2,,,,,BEV (Battery Electric Vehicle),,1st Row (Driver and Passenger),Standard,Standard,Standard,Standard,Standard,Standard,Optional,Standard,Standard,Standard,Standard,Standard,Standard,Standard,Standard,,,Standard,,Standard,,,,1,,,"Type 2 manual seatbelts (FR, SR*3), PODS",,,,,,,,,,,Standard,,,,Optional,,,,,CD + Stereo,,,,,,,,,,,
5N1DR2MM3KC624386,0,0 - VIN decoded clean. Check Digit (9th position) is correct,5N1DR2MM*KC,,NISSAN,"NISSAN NORTH AMERICA, INC.",Pathfinder,2019,SMYRNA,,,MULTIPURPOSE PASSENGER VEHICLE (MPV),UNITED STATES (USA),Nissan North America Inc.,TENNESSEE,Sport Utility Vehicle (SUV)/Multi-Purpose Vehicle (MPV),4,"Class 1D: 5,001 - 6,000 lb (2,268 - 2,722 kg)",Not Applicable,Not Applicable,Not Applicable,Not Applicable,Not Applicable,Not Applicable,Not Applicable,4WD/4-Wheel Drive/4x4,,,3500.0,213.58310433156,3.5,Gasoline,,,,Manual,1st Row (Driver and Passenger),1st Row (Driver and Passenger),,,,,,,,,,,,,,,,,,,,,Standard,,,,,,,,,,,,,,,,,,,,,,,,,1st and 2nd and 3rd Rows,"Driver and passenger frontal air bags, 3-point manual belts, side air bags, and curtain side air bags  2nd row outboard 3-point manual belts and curtain side air bags, 2nd row center 3-point manual belts  3rd row outboard 3-point manual belts and curtain side air bags",,Wagon body style,,,,,Crossover,,,,,,,,,,,,,,,,,,,,,,,,
3C6URVJG9LE108782,0,0 - VIN decoded clean. Check Digit (9th position) is correct,3C6URVJG*LE,,RAM,CHRYSLER DE MEXICO TOLUCA,ProMaster 3500,2020,SALTILLO,,VF,TRUCK,MEXICO,SALTILLO VAN/TRUCK ASSEMBLY PLANT,COAHUILA,Cargo Van,,"Class 2H: 9,001 - 10,000 lb (4,082 - 4,536 kg)",Not Applicable,Not Applicable,Not Applicable,Not Applicable,Not Applicable,Not Applicable,Not Applicable,FWD/Front-Wheel Drive,Hydraulic,6,3600.0,219.68547874103,3.6,Gasoline,V-Shaped,,,Manual,1st Row (Driver and Passenger),All Rows,,159,,,,,,,Left-Hand Drive (LHD),,,,,,,,280,,FCA,,,,,,,,,,,,,,,,,,,,,,,,,,,,,,,,,,,"Wheelbase: Extended Body - 159X""",,,,,,,,,,"The Model Year decoded for this VIN may be incorrect. If you know the Model year, please enter it and decode again to get more accurate information.",,,,,,,,,,,,,,
1G1JF5SB0J4135237,0,0 - VIN decoded clean. Check Digit (9th position) is correct,1G1JF5SB*J4,,CHEVROLET,GENERAL MOTORS LLC,Sonic,2018,ORION,,Premier,PASSENGER CAR,UNITED STATES (USA),GMNA,MICHIGAN,Sedan/Saloon,4,"Class 1: 6,000 lb or less (2,722 kg or less)",Not Applicable,Not Applicable,Not Applicable,Not Applicable,Not Applicable,Not Applicable,Not Applicable,FWD/Front-Wheel Drive,,4,1400.0,85.43324173262,1.4,Gasoline,,,Yes,Manual,1st Row (Driver and Passenger),1st and 2nd Rows,Direct,99.40,"Class 1: 6,000 lb or less (2,722 kg or less)",Not Applicable,Not Applicable,4,17,17,Left-Hand Drive (LHD),5,2,Automatic,2,,"LUV - MFI, Variable Valve Timing, ALUM, E85 MAX",,,,GME,1st Row (Driver and Passenger),Standard,Standard,Standard,Standard,,Standard,,,Optional,Standard,,,Optional,,Standard,,Standard,Standard,,Standard,19820.00,Multipoint Fuel Injection (MPFI),108,,Dual Overhead Cam (DOHC),All Rows,AYF - Active Manual Belts,Rear Park Assist (with only Rear Sonar Sensors): Optional; Hill Start Assist,,,,,,,,,,,,,,,4,,,,,,,,,,,,,,,
JM3KFBCL1R0459258,0,0 - VIN decoded clean. Check Digit (9th position) is correct,JM3KFBCL*R0,,MAZDA,MAZDA MOTOR CORPORATION,CX-5,2024,HIROSHIMA,,Preferred Package,MULTIPURPOSE PASSENGER VEHICLE (MPV),JAPAN,MAZDA,,Sport Utility Vehicle (SUV)/Multi-Purpose Vehicle (MPV),,"Class 1C: 4,001 - 5,000 lb (1,814 - 2,268 kg)",Not Applicable,Not Applicable,Not Applicable,Not Applicable,Not Applicable,Not Applicable,Not Applicable,4WD/4-Wheel Drive/4x4,,4,2500.0,152.55936023683,2.5,Gasoline,In-Line,,,Manual,1st Row (Driver and Passenger),1st Row (Driver and Passenger),Direct,,,,,,,,,5,2,Automatic,,,PY,,187,,Mazda,,Standard,Standard,Standard,Standard,,Standard,Standard,Standard,Standard,Standard,Standard,Standard,Standard,Standard,Standard,Standard,,Standard,LED,Standard,,,,6,,1st and 2nd Rows,1st Row: Seat Belt w/s Pretensioners / 2nd Row: Seat Belt w/ Pretensioners & Curtain Airbag (Outer Positions),,Wagon Body Style,,,,,,Yes,,,,,,Water,,,,,,,,,,,,,,,,,
JM1BJ2214Y0270190,0,0 - VIN decoded clean. Check Digit (9th position) is correct,JM1BJ221*Y0,,MAZDA,MAZDA MOTOR CORPORATION,Protege,2000,HIROSHIMA,Sedan,,PASSENGER CAR,,Mazda Motor Corporation,,Sedan/Saloon,4,"Class 1: 6,000 lb or less (2,722 kg or less)",Not Applicable,Not Applicable,Not Applicable,Not Applicable,Not Applicable,Not Applicable,Not Applicable,,,,,,,,,,,,1st Row (Driver and Passenger),,,,"Class 1: 6,000 lb or less (2,722 kg or less)",Not Applicable,Not Applicable,,,,,,,,,,FPD,,110,,,,,,,,,,,,,,,,,,,,,,,,,,,,,,,,,,,,,,,,,,,,,,,,134,,,,,,,,,,,,,
KM8J3CA40MU396861,0,0 - VIN decoded clean. Check Digit (9th position) is correct,KM8J3CA4*MU,,HYUNDAI,HYUNDAI MOTOR CO,Tucson,2021,ULSAN,,"Value, SEL, Sport, Limited, Ultimate",MULTIPURPOSE PASSENGER VEHICLE (MPV),SOUTH KOREA,,,Sport Utility Vehicle (SUV)/Multi-Purpose Vehicle (MPV),4,"Class 1C: 4,001 - 5,000 lb (1,814 - 2,268 kg)",Not Applicable,Not Applicable,Not Applicable,Not Applicable,Not Applicable,Not Applicable,Not Applicable,4WD/4-Wheel Drive/4x4,,4,2000,122.0474881894,2,Gasoline,,,,Manual,1st Row (Driver and Passenger),1st Row (Driver and Passenger),Direct,105.10,,,,4,,,Left-Hand Drive (LHD),5,2,Automatic,2,,GDI Nu,,161.00,,HMC,,Standard,Standard,,Standard,,,,,Standard,,,,Standard,Standard,Standard,,,,,,,,,6,Dual Overhead Cam (DOHC),1st and 2nd Rows,Seat Belt: All Positions,,Wagon Body type,,,,,,,,,,,,,,,,,,,,,,,,,,,,,
2T1BURHE1JC967886,0,0 - VIN decoded clean. Check Digit (9th position) is correct,2T1BURHE*JC,,TOYOTA,TOYOTA MOTOR MANUFACTURING CANADA,Corolla,2018,CAMBRIDGE,ZRE172L,L/LE/SE/XLE/XSE,PASSENGER CAR,CANADA,"Toyota Motor Manufacturing, Canada, Inc.",ONTARIO,Sedan/Saloon,4,"Class 1: 6,000 lb or less (2,722 kg or less)",Not Applicable,Not Applicable,Not Applicable,Not Applicable,Not Applicable,Not Applicable,Not Applicable,4x2,,4,1798,109.84273937051,1.8,Gasoline,In-Line,Sequential MPI  ,,Manual,1st Row (Driver and Passenger),1st Row (Driver and Passenger),Direct,106.3,"Class 1: 6,000 lb or less (2,722 kg or less)",Not Applicable,Not Applicable,4,,,Left-Hand Drive (LHD),5,2,,2,,2ZR-FE,,132,,Toyota,Driver Seat Only,Standard,Standard,Standard,Standard,,,Standard,Standard,Standard,Standard,Standard,,Standard,Standard,Standard,,,Standard,,Standard,18600.00,Multipoint Fuel Injection (MPFI),111,6,Dual Overhead Cam (DOHC),All Rows,,"Keyless Ignition: Standard for XLE, SE6MT and XSE trims, Optional for SE trim",,,Calipers / Front Vented Discs,,,Manual Transmission / CVT,Yes,,Passenger Seat Only,Standard,4,,,,,,148,Standard,,,,,,1,,,,,,
2FMTK4J82FBB70057,0,0 - VIN decoded clean. Check Digit (9th position) is correct,2FMTK4J8*FB,,FORD,"FORD MOTOR COMPANY OF CANADA, LTD.",Edge,2015,OAKVILLE,,SEL,MULTIPURPOSE PASSENGER VEHICLE (MPV),CANADA,Oakville Assembly,ONTARIO,Sport Utility Vehicle (SUV)/Multi-Purpose Vehicle (MPV),4,"Class 1D: 5,001 - 6,000 lb (2,268 - 2,722 kg)",Not Applicable,Not Applicable,Not Applicable,Not Applicable,Not Applicable,Not Applicable,Not Applicable,AWD/All-Wheel Drive,Hydraulic,6,3500.0,213.58310433156,3.5,Gasoline,V-Shaped,,,Manual,1st Row (Driver and Passenger),1st and 2nd Rows,Direct,,,,,,,,,,,,,,,,,,Ford,,,,,,,,,,,,,,,,,,,,,,,,,,,,,,,,,,,,,,,,,,,,,,,,,,,,,,,,,,,
1N4AL3AP8FC286704,0,0 - VIN decoded clean. Check Digit (9th position) is correct,1N4AL3AP*FC,,NISSAN,"NISSAN NORTH AMERICA, INC.",Altima,2015,SMYMA,,,PASSENGER CAR,UNITED STATES (USA),Nissan North America Inc.,TENNESSEE,Sedan/Saloon,4,"Class 1: 6,000 lb or less (2,722 kg or less)",Not Applicable,Not Applicable,Not Applicable,Not Applicable,Not Applicable,Not Applicable,Not Applicable,FWD/Front-Wheel Drive,,4,2500.0,152.55936023683,2.5,Gasoline,,,,Manual,1st Row (Driver and Passenger),1st and 2nd Rows,Direct,,"Class 1: 6,000 lb or less (2,722 kg or less)",Not Applicable,Not Applicable,,,,,,,,,,,,,,,,,,,,,,,,,,,,,,,,,,,,,,,,,1st and 2nd Rows,,,,,,,,,,,,,,,,,,,,,,,,,,,,,,,,
